URL,Date,Post,Likes,Comments
CaaGaPMLBOm,2022-06-19,"From giving advice to pointing us in the right direction, many of us owe a lot to a father figure in our lives. It’s time to celebrate them. #FathersDay #DreamAhead"," 1,751 ", 9 
CbksIPhFJ26,2022-06-23,"For long, quiet drives along the sea, next to the sand, under the sky. #DreamAhead"," 1,976 ", 8 
CcDkqlYpzcS,2022-08-11,"Blue means go. Monterey Car Week.
8.19.22. #BlueMeansGo #DreamAhead
#MontereyCarWeek"," 2,054 ", 19 
CdgNv40rCNp,2022-09-08,"Every micron matters. That’s the philosophy that guided us as we created a remarkably efficient electric motor that produces more power with less weight. Peter and Emad explain how we did it in an all-new Tech Talks, streaming debut coming Tuesday. #DreamAhead"," 2,228 ", 32 
CfJ5NLMvt1X,2022-06-30,"From the moment we arrived in England for this year’s Goodwood Festival of Speed, excitement was in the air. Here’s to our love for motorsports, and our 1,050-hp #LucidAir Grand Touring Performance taking home the award for fastest production car in the hillclimb shootout. Link in bio. #FOS"," 2,455 ", 17 
CfKR99ovPD9,2022-05-04,Stay cool. #DreamAhead," 2,465 ", 20 
CfWp1VZsGhM,2022-03-28,"Empowered, in power, behind the scenes, center stage — celebrating women across business. DefJam #LucidMotors #WomensHistoryMonth"," 2,494 ", 18 
CfcFtAIJqfp,2022-06-23,"Introducing the #DreamAhead Tour. We’re kicking off this cross-country event at our HQ. Select #LucidAir reservation-holders will be able to meet the team that created Lucid Air, learn what makes it such an amazing vehicle, and get behind the wheel to experience it."," 2,818 ", 20 
Cf4MXB5leaJ,2022-07-11,"Streaming tomorrow: Don’t miss Tech Talks, ep. 3 as we explore the Wunderbox, part of the most advanced, most adaptable EV charging system in the world. Hosted by Eric Bach, SVP of Product and Chief Engineer. #DreamAhead"," 2,924 ", 18 
Cf6wSpLM-HI,2022-07-15,The dream continues in Amsterdam as we bring the future of electric vehicles to the famous Transformatorhuis. #DreamAhead," 3,112 ", 30 
Chgkv6VA82G,2022-01-28,"Our new Lucid Studio in Montreal, Canada is officially open. Stop by our location and experience #LucidAir"," 11,126 ", 118 
ChfWO0dJCQS,2022-01-29,"Our latest Studio is now open at @fashionisland in Newport, CA. Keep an eye on our Stories for live updates. #DreamAhead"," 11,193 ", 127 
CiQGf8krTdM,2022-10-18,Take a ride on the dark side with #LucidAir's Stealth Look. Its 35 unique components completely change the character of an already expressive vehicle. Design yours now. #DreamAhead," 11,206 ", 88 
Ci0LDj0MDVB,2022-12-30,Pure joy. We’re excited to announce the first deliveries of #LucidAir Pure. A warm welcome to the newest members of the #LucidOwnersClub," 11,425 ", 123 
Ck1AmbesHJE,2022-11-15,Live from the Beverly Hills Lucid Studio for our ‘In the Air — and Beyond’ exclusive Lucid Launch Event. #LucidGravity," 11,705 ", 83 
ClAhIDVrnsn,2022-05-13,"We’ve officially landed in Europe. We’re proud to be sharing the most-efficient, longest-range #EV with the world, right here in Munich, Germany. #LucidAir #DreamAhead"," 12,487 ", 170 
Ck_gKhXvuZo,2022-08-09,It doesn't exactly fly under the radar. The all-new Stealth Look. #LucidAir," 13,201 ", 150 
Cl3_npMvrDC,2022-03-26,Today marks the opening of our latest international Studio in Toronto??. Keep an eye on our Story for live updates. #DreamAhead," 13,284 ", 129 
CmelKYSs6yF,2022-08-19,"The first Sapphire, and certainly not the last. #LucidAir Sapphire. Unleashed this morning at Monterey Car Week. Link in bio. #BlueMeansGo"," 15,535 ", 152 
CnmsWs3P9TX,2022-11-15,"Introducing Lucid Gravity – our next force of nature. A true next-generation luxury SUV built upon our core Lucid DNA of luxury, spaciousness, performance, and efficiency. Link in bio."," 27,314 ", 447 
